company,job_title,location,salary,company_size,company_founded,company_type,company_industry,company_sector,company_revenue,job_description
Hydro Tasmania3.4 ★,Generation Dispatch Engineer,Hobart,"$118,341",1001 to 5000 Employees,1914,Company - Private,Energy & Utilities,"Energy, Mining, Utilities",$100 to $500 million (USD),"Job no: 497065 Work type: Permanent Full time Location: Hobart Categories: Commercial Operations  Remotely monitor power stations, manage water storages and develop trading strategies to deliver renewable hydroelectricity to the National Electricity Market  Enjoy flexible work arrangements tailored to suit your lifestyle Help keep the lights on, maximise commercial returns and support the State and People of Tasmania. Work in the Control Room of Australia’s largest generator of renewable energy  Salary range $109,612 – $127,070 plus super and shift allowance  At Hydro Tasmania, we’re leaders in renewable energy, powering Australia with clean hydropower. We really care about making a difference for better, but it’s a big job and we can’t do it alone. Which is right where you come in.  Hydro Tasmania supports applications from all members of our community for equitable access to our employment opportunities. We are open to discussing workplace flexibility in all our vacancies, to ensure we can attract the best candidates and accommodate individual needs, differences, disabilities and working arrangements, even in ways we have not thought of. Our merit based recruitment practices are founded on building diversity by fostering an inclusive, flexible and equitable workplace.  About You:  Your success in this role will be fuelled by your knack for solving problems: take in data, figure out a strategy and apply it. We are looking for someone who:  Has a love of learning: there’s so much to learn and the environment we work in is continually evolving. Is a team player but can work autonomously. Collaboration and communication with your team are vital in this role but when required, you are able to take the reins and exercise independent judgement when the situation calls for it A tertiary qualification in a technical discipline such as Engineering, Maths or Science (or equivalent experience with power station control and/or maintenance)  About the role:  Hydro Tasmania manages more water per year than any other company in Australia – the equivalent of over 26 Sydney Harbours. Help figure out how best to use this precious resource.  It’s a complex puzzle to piece together, and you’ll work in collaborative team to dispatch 27 hydroelectric power stations and manage 50+ water storages in line with our environmental, societal and economic guidelines.  Tying together water management and dispatch, you’ll optimise when to provide clean energy to the National Electricity Market to maximise short-term trading revenue.  This role requires participation in a flexible hybrid model as part of a 24 hour shift roster. Further information can be found in the attached Position Description: PD - Commercial - Generation Dispatch Engineer - HT4 - November 2021.pdf  What you’ll get back  This is an opportunity to grow your career and redefine your role in tomorrow’s industry landscape. We offer truly flexible work that suits you, a competitive remuneration package, and the rare opportunity to play a role in Australia’s renewable energy transformation while enjoying the – lifestyle Tasmania has to offer.  Hydro Tasmania is an endorsed employer for all women. See our range of benefits and the great work we do through our Work180 page: Hydro Tasmania group | WORK180 Endorsed Employer  If you want to make a difference for better  Please attach your resume and a cover letter outlining what skills and experience you will bring before Monday 27 November 2023.  Recruitment agencies: we respectfully ask that no agency resumes be presented at this stage.  Advertised: 03 Nov 2023 Tasmania Daylight Time Applications close: 27 Nov 2023 Tasmania Daylight TimeShow moreReport"
Wrest Point Hobart Hotel,Senior Data & Software Engineer,Hobart,,,,,,,,"Job no: 501808 Work type: Full time Location: Hobart Categories: Information Technology  Federal Group is a Family-owned business with over 2500 employees across a range industry leading brand. These include Hospitality and Tourism, Sensitive Freight as well as Gambling Technology. We are on a journey to transforming our information technology landscape and are looking for individuals who want to contribute to this. Federal Group is driven by it's focus on being number one or two in the markets it serves and enabling these world class operations though technology is critical.  Are you ready to apply your Technical and Business acumen to multiple exciting projects and be part of a high performing team? We have critical projects for you to help lead from project commencement to completion. Our Technology team provide internal technology support across Federal Group's multi-faceted businesses, including tourism and hospitality, freight, to gaming and retail. This diversity offers engineers the opportunity to apply their expertise in a wide variety of applications and extend their professional network. We are seeking a highly skilled and experienced Senior Data and Software Engineer to join our dynamic team.  The Senior Data and Software Engineer will utilise capabilities and experience in business intelligence, low-code solutions, APIs, data analytics, power platform and SharePoint to design and lead implementation of solutions across the business. The role will mentor a small team and work closely with all areas of the business to provide critical data insight and robust business solutions.  Key responsibilities:  Architecting, developing, and maintaining software applications and data solutions on the Azure platform (Including complex integrations, APIs and data engineering). Implementing DevOps CI/CD pipelines for efficient software deployment and infrastructure automation. Utilizing Low-Code, APIs and Power Platform tools to accelerate application development. Leveraging Business Intelligence tools to create insightful and actionable reports and dashboards. Collaborating with cross-functional teams to enhance SharePoint integration and functionality. Providing technical leadership and mentorship to a small team of engineers. Utilizing PowerBI for data visualization and analytics. Working with Databricks for big data processing and analytics. Practicing SCRUM and Agile methodologies for efficient project management and delivery. Fostering a culture of teamwork and collaboration within the platforms team.  Required skills:  Bachelor's or Master's degree in Computer Science, Software Engineering, or a related field. Proven experience working with Azure Platform and its services (including: Azure Data Factories, Logic Apps, Automate and Function Apps). Expertise in DevOps CI/CD, including the setup of pipelines and automation. Proficiency in Low-Code and Power Platform tools. Strong SQL query skills and some experience with management and administration. Experience with Business Intelligence, PowerBI (preferred) and data visualization. Knowledge of SharePoint integration and design. Strong leadership and mentorship skills. Familiarity with Databricks for big data processing. Demonstrated experience with SCRUM and Agile methodologies. Excellent teamwork and communication skills.  This is the opportunity you have been looking for! Our team is small, but our outputs are impressive. We value the skills and perspective each team member brings. We work collaboratively to bring each team member along for the journey and will support you to build up any skill gaps you may have.  We offer a competitive remuneration package and free parking, lunch, dry cleaning, and staff discounts across our group of businesses.  Apply now! To find out more about joining our team please contact Nathan.Dunn@federalgroup.com.au   Advertised: 31 Oct 2023 Tasmania Daylight Time Applications close: 20 Nov 2023 Tasmania Daylight TimeReport"
Entura3.1 ★,Water Resources Engineer,Hobart,"$95,076",201 to 500 Employees,--,Subsidiary or Business Segment,Business Consulting,Management & Consulting,Unknown / Non-Applicable,"Water Resources Engineer Proudly leading the way with renewable energy design. Meaningful work that changes lives working with teams that care. Based in Hobart with real flexible work arrangements.  HEY! Stop scrolling! This is the role you have been waiting for.  Who is Entura?  Entura is a highly experienced specialist power and water consulting firm, uniquely positioned as both asset owner and consultant. With over 100 years of experience in renewable energy and water infrastructure, we offer comprehensive solutions throughout the asset lifecycle. We are dedicated to empowering people and communities with clean energy in an environmentally and socially responsible manner.  About You  You care about the environment, you love to work with a team, you know what a healthy, collaborative culture looks like and that is important to you. You enjoy working with smart, dedicated and genuinely nice people and you love the challenge of making the world a better place through clean, renewable energy projects.  We can’t wait for you to join our team and share your experience as a Water Resources Engineer and bring your skills and experience to the team. You will bring your strong working knowledge of Australian hydrological and hydraulic practices including current design guidelines and standards.  From a practical perspective your skills and experience might include:  Tertiary qualifications in civil or environmental engineering, science or hydrology as required for admission as a member of Engineers Australia or equivalent. Strong hydraulic, hydrologic modelling and flood forecasting skills using a range of standard industry software. Use of civil design and documentation software, either Autodesk Civil3D or 12D. Demonstrated experience in a consulting environment.  About the Role  As a Water Resources Engineer, you’ll provide technical delivery and management of hydraulic and hydrology assignments associated with the analysis of hydraulic, hydrological, meteorological, and environmental data and the design of civil infrastructure with a water focus. In particular related to hydropower and other renewal energy projects.  You will work collaboratively with other members of the team to grow the business through efficient and effective project delivery whilst maintaining a focus on quality, innovation, training, and the use of new methodologies that adds value to our clients.  Why Work with Entura?  At Entura, we nurture a culture of creativity and innovation, providing room for personal and professional growth. With a wide array of exciting projects, you'll experience endless variety and exposure to cutting-edge technologies. Our team consists of talented individuals, many with years of experience, imparting their deep knowledge to support your growth.  At Entura, we're dedicated to making the world more sustainable through innovative engineering solutions, giving you a sense of purpose and fulfilment. Whether you're an experienced innovator or starting your career, we're committed to your success within our organization.  In addition to innovative projects, we offer:  Genuine life/work balance. Industry leading parental leave entitlements. Uncapped carer/sick leave. Bonus program. Subsidised school holiday vacation care. Flexible work arrangements. Discounted Health Insurance. Access to free Employee Assistance Program for you and your family. A genuinely inclusive and equitable work environment. Clear career path and support networks.   What Next?  If this opportunity excites you, apply now by submitting your CV and a compelling cover letter. We value diversity and inclusion and welcome applications from candidates of all ages, cultural backgrounds, abilities, and genders. Let us know of any specific requirements to facilitate your application process for the best opportunity for success. Explore our website at www.entura.com.au to learn more about our impactful initiatives and Our Way – a unique approach that defines us as pioneers in the engineering industry.  CLOSING DATE - 9am Monday 27 NovemberShow moreReport"
"Australian Government - Department of Climate Change, Energy, the Environment and Water",Senior Aquarium Technician,Kingston,"$82,358",,,,,,,"APS 5 - $78,548 - $86,168 per annum plus superannuation Australian Antarctic Division Kingston, TAS  Support the operation of the Antarctic marine research aquarium and mobile containerised research aquarium facilities. Work with researchers to design and build aquarium-based experimental systems to support research on live Antarctic marine organisms. Look after and culture aquarium livestock in the only research facility to close the life cycle of Antarctic krill.   Who we are The Australian Antarctic Division (AAD) is part of the Commonwealth Department of Climate Change, Energy, the Environment and Water. As primary agency for Australia's Antarctic Program (AAP), the AAD is responsible for achieving the Australian Government's Antarctic goals.  These goals are to: Maintain the Antarctic Treaty System and enhance Australia's influence within it. Protect the Antarctic environment. Understand the role of Antarctica in the global climate system. Undertake scientific work of practical, economic and national significance.   The AAD also has responsibility for administering the Australian Antarctic Territory and the Territory of Heard and McDonald Islands.  The Assets and Technology (A&T) Branch provides and maintains the equipment and infrastructure to support the AAP. A&T Branch activities range from the maintenance of existing Antarctic stations and equipment through to the design, manufacture, testing, operation and procurement of advanced scientific equipment and systems. The Branch manages major infrastructure projects in support of AAP outcomes.  The Capabilities and Facilities section supports Southern Ocean and Antarctic research in the fields of aquaria, labs, engineering and marine science. Our diverse team manages lab facilities, cold store and samples both on station and at AAD headquarters, marine science assets, compliance and regulatory requirements, and workshops that design and construct bespoke technical equipment and facilities for the AAP.  The Job The position will work at Kingston in the Marine Research Aquarium facility (aquarium) and at sea as required to support mobile containerised aquarium research facilities (containerised aquaria). The position will report to the Science Support Technical Manager and work under direction from the Marine Research Aquarium Manager.  Key duties will include, but are not limited to: Support daily operations of the aquarium including: Day to day maintenance and husbandry of Antarctic krill and other livestock including rostered weekend duties. Continual production of live algal cultures. Maintain water filtration equipment. Participate in the after-hours on-call roster. Maintain records of all required inspections, maintenance, repairs and certifications; and Contribute to the support of researchers/students. As required, assist in the forward planning, experimental set up and pre-voyage testing of containerised aquaria. Work in environments where priorities can change, sometimes with short notice and/or shifting timeframes. As required, participate in marine science voyages by being responsible for the technical configuration, operation, and maintenance of containerised aquaria whilst at sea and provide aquarium support to researchers and students working at sea. Advise aquarium users on the safe set up and use of experimental systems in the aquarium and containerised aquaria. Conduct regular quality and safety audits of the aquarium and containerised aquarium facilities.   What we are looking for Knowledge and experience We are seeking applicants with demonstrated: Knowledge of the design and function of recirculating aquarium systems (experience with marine research systems is desirable). Experience with operation, maintenance and troubleshooting of research or aquaculture aquarium systems, plant and equipment including process control software. Experience working at sea for extended periods (supporting marine science voyages is desirable). Knowledge of Work Health & Safety (WHS) and experience in maintaining a safe workplace for aquarium facilities. Track record of working within biosecurity requirements (experience in Biosecurity Approved Arrangement premises is desirable) and complying with environmental responsibilities.   Skills and capabilities We are seeking applicants who have demonstrated: Skills in marine invertebrate husbandry and handling in research or aquaculture aquarium systems (experience with Antarctic krill or other similar marine invertebrates is desirable). Skills in maintaining algal and other live feed cultures. Good laboratory skills, working within a lab environment and experience in maintenance and calibration of instrumentation for water quality analysis. Ability to maintain data sets, analyse data and write technical reports relating to the operation of aquarium facilities. Excellent verbal communication skills with the ability to build and manage relationships with internal and external stakeholders and suppliers.   Please note that the successful applicant may be required to travel to the Antarctic and sub-Antarctic regions therefore they may be required to meet specific medical, adaptability and personal qualities requirements appropriate to working in those environments.  In order to undertake travel to the Antarctic & sub-Antarctic regions they will need to: Demonstrate the range of personal qualities and interpersonal skills necessary to perform as a successful team member within isolated Antarctic and sub-Antarctic environments. Demonstrate an ability to effectively adapt and respond to the demands of living and working in an isolated and confined environment as determined by a psychological (adaptability) assessment. Be certified as fit for Antarctic service by the AAD’s Polar Medicine Unit.   Mandatory qualifications A degree in Aquaculture, Science, Biology or other relevant discipline from an Australian tertiary institution, or a comparable overseas institution, or demonstrated equivalent experience.  For additional information, please read the Job Description below.  Candidate Information Pack (PDF) Opens in new window  Candidate Information Pack (Docx) Opens in new windowShow moreReport"
Mission Australia3.7 ★,Family Support Practitioner,Hobart,"$83,988",1001 to 5000 Employees,--,Government,"Civic, Welfare & Social Services",Non-profit & NGO,$100 to $500 million (USD),"$83,988 + super + not for profit salary packaging Permanent Full Time Contract Location: Rosny Park TAS 7018 Rewarding work – every day you know you are making a real difference Life at Mission Australia When you join the team at Mission Australia, you become part of a community who are determined to end homelessness and ensure people in need can thrive. United by our Christian purpose and values, we stand together with anyone who needs us, for as long as they need us. Find out more about us and our purpose. Your Opportunity In this rewarding career opportunity, based in Rosny Park you will join a well-established, small team of experienced practitioners and contribute to programs which have been operating since 2009. This is an exciting hybrid role, where you will have the opportunity to utilise your case management skills across two programs - as the Community Kinship Program (CKP) practitioner and Integrated Family Support Service (IFSS) practitioner. CKP works with informal kinship carers who have taken on the primary care of a related child. This support includes case management, coordination of support groups and school holiday programs. IFSS is a voluntary service focused on increasing the safety, stability, and wellbeing of children, young people, and their families by providing support and resources to build family strengths, resilience, and capacity. The service provides early intervention for children and families at risk of entering the Child Safety system. This is done by supporting the family to identify patenting-based goals and then working collaboratively to achieve these. Your Key Responsibilities Engage with families and work together to develop effective plans for long-term positive outcomes. Actively work with families to identify goals that will promote safety, well-being and belonging for their children. Working with families in their homes and at other suitable locations, to overcome barriers to engagement both actively and proactively. Undertaking case management tasks including assessments, reviews, reporting, referrals, local area intake and other administrative functions ensuring all are completed accurately and in a timely fashion. Create and update individualised case management plans for all clients. Coordinate and participate in stakeholder meetings with other services and clients. Facilitate support groups for CKP carers. Plan, organise and facilitate school holiday activities. Requirements for Success With a significant background in child, youth & family and/or Social Welfare/Social Science, you will be confident in your case management and assessment processes. Other requirements include: A minimum of a Diploma in Community services or related discipline. Experience in Community Services – working with youth and families highly regarded. Demonstrated experience in engaging and working therapeutically with children and families and people with a disability. Must have compassion, kindness, and a high degree of empathy. Ability to use computer systems to complete data entry, case notes, reports etc. Strong experience with facilitating group sessions.  Knowledge of childhood developmental stages and best practice parenting strategies including behaviour management. Demonstrated case management experience with well-developed written and verbal communication skills. Drivers Licence required due to travel requirements for outreach. Before starting work with us, you will need to undertake a national police history check, qualifications, and referee checks, and have a clearance to work with children/vulnerable people. Our Culture Our innovative and inclusive culture will ensure you feel valued at Mission Australia as you help Australians in need and develop in your career. We’re committed to the safety and wellbeing of each other and the people we serve. We recognise and respect diversity. So, whoever you are, if you are skilled and actively support our purpose and values, you would be welcome at Mission Australia. Find out more about a career with Mission Australia. We encourage applications from people with disability and Indigenous Australians. If you have a disability and need support to submit your application, please email talentattraction@missionaustralia.com.au. Your Benefits To ensure our employees feel valued, empowered, and celebrated, we provide a range of employee benefits including: Make a meaningful difference to the lives of Australians in need Not-for-profit salary packaging, reducing your tax (details via AccessPay) Generous employee discounts with health insurance and major retailers Free external, confidential counselling and access to chaplaincy support. Volunteering opportunities Extra leave available including an additional public holiday and the opportunity to purchase further annual leave. How To Apply To be considered for this opportunity, click ‘apply’ and send your application today! As a committed Circle Back Initiative employer, we will respond to your application. Applications for this role are shortlisted as received. Be quick to apply for this exciting and diverse role.Show moreReport"
