company,job_title,location,salary,company_size,company_founded,company_type,company_industry,company_sector,company_revenue,job_description
Serco3.4 ★,Program Delivery Officer-Clarence Correctional Centre - Grafton NSW,Australia,,10000+ Employees,1987,Company - Public,HR Consulting,Human Resources & Staffing,$5 to $10 billion (USD),"Build a career that takes you places Join the Rehabilitation team & make a difference every day Live by the beach or hinterland About the Opportunity In your position as Program Delivery Officer you will liaise with staff across the Centre as part of a multi-disciplinary team regarding the management of individual inmates. With tertiary qualifications in Psychology, Criminology, Social Work, Social Sciences or relevant industry experience you will be delivering through group facilitation therapeutic programs and manual based intervention to promote positive change to address the offending behavior. About you, your ideal skills & experience You are an experienced group facilitator, with proven experience ideally working across complex mental health or behavioural issues. You have a proven ability to work effectively and proactively in a team environment and enjoy working collaboratively with others to achieve the goals and objectives of the Centre. You understand the importance of creating and maintaining a culturally sensitive environment including respecting the diversity of inmates, staff and other stakeholders. Have tertiary qualifications in Psychology, Criminology, Social Work, Social Sciences or relevant industry experience Ideally hold Certificate IV in Correctional Practice (Case Management) or completed within the first 12 months of employment Experience working with correctional, welfare or institutional setting (desirable) Experience in group facilitation, ideally dealing with complex mental health of behavioural issues Adhere to Serco’s Values, Code of Conduct and key operating principles in every interaction with staff, internal and external stakeholders Actively promote a safety culture and follow all health and safety standards and processes Ensure that inmate administrative requirements of document and data management are maintained in accordance with compliance standards Demonstrate a high level of personal integrity and ethical behaviour Possess sound judgement and well developed communication and interpersonal skills Be experienced in the preparation of accurate reports and submissions Understand the social and clinical variables associated with major offence categories Maintain the highest level of integrity and ethical behaviour This is a position of trust and responsibility and to support this we will conduct a thorough probity assessment, which includes a national police check as an essential selection component for this role. Serco requires employees in this role to be fully vaccinated against COVID-19 to ensure the safety and wellbeing of our people. Please consider this requirement when submitting your application. What We Offer Uniform Provided Car Parking on site Work-life balance Access to EAP (Employee Assistance Program) Internal employee benefits Supportive team & management Join Us If you are inspired to impact for a better future and make a positive difference, we want to hear from you NOW. Serco and Proud At Serco, not only is the nature of the work we do important, everyone has an important role to play, from caring for vulnerable people to managing complex public services. We are a team of 50,000 globally and 14,000 in Asia Pacific responsible for delivering essential public services in areas including defence, justice, immigration, healthcare, facilities management and citizen services. Serco’s values of Trust, Care, Innovation and Pride underpin everything we do. We are curious, creative and collaborative. Our people matter and make a difference every day. We seek and celebrate diversity and encourage applications from all backgrounds and cultures including Aboriginal and Torres Strait Islander people, LGTBQI+, veterans and people with disability. By joining Serco you will have access to Employee Networks led by colleagues who are passionate about diversity, inclusion and belonging VideoShow moreReport"
Hobart Community Vet Clinic Hospital,Veterinarian,Australia,,,,,,,,"Join us and make a difference!  About our hospital  Hobart Community Veterinary Hospital offers a unique experience for veterinary professionals. The hospital is operated under the experienced management of one of Australia’s most trusted animal welfare charities that have successfully run community vet clinics since 2001 and is one of four in Australia.  We are committed to keeping pets and people together. The Hobart Community Veterinary Hospital’s charter is that no sick or suffering animal is ever turned away, irrespective of an owner’s capacity to pay for treatment. This ensures that people never need to face a decision to euthanise or surrender their much-loved companions unnecessarily.  We all share a common passion at the Hobart Community Veterinary Hospital. Whether affected by illness or injury, the animals we help need your expertise and compassion. You could wake up every day knowing you’ll be helping to keep pets and people together in a fulfilling environment where no two days are the same!  At Hobart Community Veterinary Clinic, we focus on reducing euthanasia rates and helping less fortunate animals receive the veterinary attention they deserve.  About the role  Hobart Community Veterinary Hospital is currently looking for a full -time Veterinarian to join our team!  The Veterinarian is responsible for delivering high quality care to community veterinary clinic patients. This includes communicating treatment plans to owners, coordinating care of patients, providing medical and surgical treatment and promoting preventative health care. You’ll be working within a team of highly skilled and passionate veterinary professionals under the banner of one of the most respected brands in animal welfare. If you are passionate about making a direct impact in animal welfare, we’d love to talk to you.  Key Responsibilities  Conduct activities to a standard expected by the Veterinary Surgeons Board and company policies Desex small animals Assess, diagnose and treat sick/injured animals by prescribing appropriate treatment Carry out routine examinations and diagnosis Prescribe and administer medications and anaesthesia Carry out routine surgical procedures Perform radiographic procedures Perform pathological testing in accordance with infection control protocols Perform euthanasia and surgical autopsy as required Perform emergency procedures and operations as required Meet animal health regulatory and legislative requirements Coordinate referral to specialist centres when indicated Coordinate referral to specialist centres when required  What are the minimum requirements for this position?  Degree in Veterinary Science Registration with the Veterinary Surgeons Board Radiation use License Authourised Implanter Number (AIN) Experience in a clinical setting Excellent Customer Service Skills Strong Interpersonal and Communication Skills Ability to manage your own time effectively and respectful of the time of others Completes tasks thoroughly with strong attention to detail within deadlines Versatility, flexibility and positivity   To be successful in this role, you will have:  Strong communication skills and the ability to develop working relationships. Exceptional time management and the ability to manage competing priorities in a fast-paced environment. A desire to coach and mentor team members to be the best they can be. Ability to provide conflict resolution and problem solve. High attention to detail, accurate data entry and records maintenance. Extensive customer service management experience.   Who are we?  Our clinic has state of the art equipment such as digital X-ray, ultrasound and advanced dental equipment including dental rads and much more. Our charter means that our clinics are exciting and busy, offering a varied case load for our vet team! You’ll have every opportunity to work with a varied case load where you’ll have the opportunity to continually increase your knowledge and surgical skills.  We are situated in the quiet, affluent suburb of Lenah Valley, just 10 minutes’ drive from the city centre surrounded by tree-covered hills with views of Mt Wellington. We are open Monday to Saturday and refer all after-hours work to a nearby emergency clinic which affords us an excellent work-life balance.  Why should you join us?  At Hobart Community Veterinary Hospital we offer competitive pay and benefits, including access to an independent Employee Assistance Program, retail discounts, vet discounts. Most importantly, every day you’ll play an instrumental role in our lifesaving work.  Our mission is to unleash the potential in every team, and we know that teams perform best when they have passion. We are committed to building a culture where everyone has the opportunity to do meaningful work and is recognised for their efforts.   Equity  Diversity and inclusion are the principles guiding how we build our teams, cultivate our leaders and build a culture of belonging where differences are valued.  Hobart Community Veterinary Hospital would like to thank all applicants for applying.Report"
Randstad3.9 ★,Business Analyst,Hobart,,501 to 1000 Employees,1960,Company - Public,HR Consulting,Human Resources & Staffing,$10+ billion (USD),"Business Analyst  12 months contract Hobart based Hourly rate: $60 per hour + super Must be Australian Citizen to apply  The APS6 Business Intelligence Lead will work with key business areas in the development and implementation of consumable reports and analytics to address key risks and emerging trends. The position will provide detailed technical, professional, policy, operational support and advice in relation to complex problems.  Responsibilities may include but are not limited to:   Undertaking data analytics and reporting, producing reports using standard statistical techniques. Extracting and presenting data in Microsoft Excel and result comparison chart formats. Drafting communication pieces and presenting business insights and recommendations. Coordinating branch reporting requirements to monitor and track improvement outcomes. Undertaking quality assurance processes, including sample audit programs and reports, quality trend analysis and outcomes analysis. Implementing and managing processes and management systems to track branch and Partner performance. Key skills required for role: Critical thinking Problem Solving Teamwork/collaboration Project Management management Intermediate/Advanced Excel Desirable skills to have for the role: Understanding of data governance Understanding large organisation interdependencies Power Automate Power Query Qualifications in data analysis, data science, statistics, computer science or mathematics Application deadline: 24th November  Apply directly using the link provided or by submitting your CV. For confidential discussion, please don't hesitate to contact me: sara.alonso@randstad.com.au At Randstad, we are passionate about providing equal employment opportunities and embracing diversity to the benefit of all. We actively encourage applications from any background.Show moreReport"
MacDonnell Regional Council,"Remote Registered Nurse ($91-97K, relocation, 6 weeks annual leave!)",Tasmania,"$92,500",Unknown,--,Company - Private,--,--,Unknown / Non-Applicable,"Dive into an impactful role in healthcare management and make a difference in the lives of many Earn $91-97K salary, relocation assistance, and 6 weeks annual leave Journey through diverse cultures and landscapes as you shape healthcare experiences About MacDonnell Regional Council  Discover the essence of community and collaboration with MacDonnell Regional Council (MRC). Since 2008, we've been the backbone of 13 vibrant remote communities, extending our influence into pastoral, tourism, and mining endeavours. Our council, elected by the very people we serve, is committed to fostering economic growth and ensuring that opportunities abound for all residents. With a focus on sustainable development, we're not just governing; we're nurturing a thriving region where every day brings new possibilities. Join us, and be part of a dynamic team making a tangible difference in Australia's heartland!  To learn more about us, visit: www.macdonnell.nt.gov.au Next Career Awaits  MRC is seeking a passionate Remote Registered Nurse to lead our Home Care Services Department in Alice Springs, NT.  This role demands more than just qualifications; it requires passion, dedication, and most importantly, the willingness to travel to remote communities (from overnight stays to two-week field assignments), immersing oneself in their unique challenges and contributing towards their well-being.  In this pivotal role, you will:  Delivering individualised clinical-based nursing care to Home Care clients Conducting clinical assessments, developing care/support plans, upgrading assessment tools, conducting reassessments, and managing data collection and reporting of client specialised needs Supporting, mentoring, and delivering clinical training to Home Care staff Providing clinical nursing advice and support to our clients and their families Liaising closely with the Home Care Manager, Home Care Coordinators, Allied Health, and community networks to maintain and ensure the highest possible standard of care Documenting all client interactions, communicating, and actioning appropriately Providing excellent client care, ensuring physical and psychological needs are met Liaising closely with ACAT referral services  For the full job description, please click Apply Now.  About You  Your dedication to enhancing the lives of Indigenous Australians will be pivotal to your success in this role, regardless of prior experience in aged care.  Key qualifications and skills include:  A Bachelor of Nursing Science or equivalent qualification Current AHPRA registration and a strong background in an Aged Care environment Proficiency in producing high-quality reports and a profound understanding of aged and disability client needs Prior experience in leadership, training, or mentoring non-clinical staff The adaptability and resilience to work in diverse cultural settings and the commitment to frequent travel to remote communities, including longer stays Valid driver's licence About the Benefits  As a valued member of the team, you'll receive a competitive annual salary ranging between $91,000 and $97,000.  Additionally, you’ll also enjoy an excellent benefits package that includes:  Relocation assistance to help you transition smoothly and comfortably to your new environment With 80% of your role involving travel to remote communities, we provide both a vehicle for your journeys and a generous travel allowance to cover your expenses 6 weeks of annual leave ensures you have ample time to rejuvenate 11% superannuation PLUS 17.5% leave loading We offer flexible full-time or part-time contract positions to suit your lifestyle needs Support for Continuing Education, Study Leave benefits, and EA provisions Embrace the unique opportunity to immerse in diverse cultures by travelling and engaging with remote communities  Join us in a role that not only offers a comprehensive compensation and benefits package, but also the chance to make a significant impact within the communities you serve. Ready to Apply?  If you want a chance to collaborate with a remarkable team, and learn from and contribute to our collective success, we want to hear from you - apply now!Show moreReport"
CSIRO4.1 ★,CSIRO Postdoctoral Fellowship in Giant Kelp: Thermal Tolerance and Genomics,Hobart,"$92,101",5001 to 10000 Employees,1926,Government,National Services & Agencies,Government & Public Administration,$500 million to $1 billion (USD),"Acknowledgement of Country  CSIRO acknowledges the Traditional Owners of the land, sea and waters, of the area that we live and work on across Australia. We acknowledge their continuing connection to their culture and pay our respects to their Elders past and present. View our vision towards reconciliation  Child Safety  CSIRO is committed to the safety and wellbeing of all children and young people involved in our activities and programs. View our Child Safe Policy.  The Opportunity Do you have a PhD in genomics, molecular biology, cell biology, molecular ecology, bioinformatics, population/quantitative genetics? Conduct impactful research through exploring links between genomes, transcriptomes and the phenotype of thermal tolerance in Giant Kelp. Join The Australian National Algae Culture Collection in this 3-year postdoctoral opportunity!  CSIRO Early Research Career (CERC) Postdoctoral Fellowships provide opportunities to scientists and engineers who have completed their doctorate and have less than three years of relevant postdoctoral work experience. These fellowships aim to develop the next generation of future leaders of the innovation system.  The Australian National Algae Culture Collection in Hobart, Tasmania is seeking a CERC Fellow to join their team to design and implement a technically challenging research project that will explore the links between genomes, transcriptomes and the phenotype of thermal tolerance in Giant Kelp (Macrocystis pyrifera). The project is in collaboration with Google, utilising Google capabilities in bioinformatics, modelling, and cloud computing. This project will draw on knowledge and expertise developed through the University of Tasmania and links with a current restoration project led by The Nature Conservancy.   As CERC Fellow, you will use PacBio sequencing to assemble a scaffold-level reference genome, population genomics across the remnant forests, and use Giant Kelp gametophyte strains in lab-based experiments to grow selected individuals and crosses to characterise the phenotype in response to temperature. Genomes and transcriptomes will be used to link genetic characteristics to phenotypes and identify key physiological attributes inherent to thermal tolerance.  Your duties will include: Culture, isolate and genotype Giant Kelp gametophyte cultures, and carry out selective crosses. Isolate high-quality, high-molecular weight, DNA suitable for PacBio sequencing from field collected samples and lab raised giant kelp individuals. Assemble a scaffold-level reference genome for Tasmanian Giant Kelp. Undertake GWAS and TWAS analysis using Google bioinformatic platforms. Carrying out innovative, impactful research of strategic importance to CSIRO that will, where possible, lead to novel and important scientific outcomes. Utilising design thinking methodology to plan and prepare research proposals, and apply non-academic impact methodology to research projects. Recording, managing, and analysing data/information using relevant domain data science techniques.  Location: Hobart, Tasmania  Salary: AU$92,624 - AU$101,459k plus up to 15.4% superannuation  Tenure: Specified term of 3 years  Reference: 94921  To be considered you will need: Essential A doctorate (or will shortly satisfy the requirements of a PhD) in a relevant discipline area, such as genomics, molecular biology, cell biology, molecular ecology, bioinformatics, population/quantitative genetics, or similar. Please note: To be eligible for this role you must have no more than 3 years (or full-time equivalent) of postdoctoral research experience. Demonstrated ability to design and implement novel genomic, other ‘omic, or bioinformatic procedures in the laboratory or field, or develop novel software or bioinformatics tools. Demonstrated ability to analyse complex biological, population, or ecological datasets. High level written and oral communication skills with the ability to represent the research team effectively internally and externally, including the presentation of research outcomes at national and international conferences.  Desirable Experience in culturing or working with seaweeds or algae. The ability to work effectively as part of a multi-disciplinary, potentially regionally dispersed research team, plus the motivation and discipline to carry out autonomous research.  For full details about this role please view the Position Description  Eligibility  Applications for this position are open to Australian/New Zealand Citizens, Australian Permanent Residents or you must either hold, or be able to obtain, a valid working visa for the duration of the specified term.  Appointment to this role is subject to provision of a national police check and may be subject to other security/medical/character requirements.  Flexible Working Arrangements  We work flexibly at CSIRO, offering a range of options for how, when and where you work.  Diversity and Inclusion  We are working hard to recruit people representing the diversity across our society, and ensure that all our people feel supported to do their best work and feel empowered to let their ideas flourish.  About CSIRO  At CSIRO Australia's national science agency, we solve the greatest challenges through innovative science and technology. We put the safety and wellbeing of our people above all else and earn trust everywhere because we only deal in facts. We collaborate widely and generously and deliver solutions with real impact.  CSIRO is committed to values-based leadership to inspire performance and unlock the potential of our people.  CSIRO is committed to the safety and wellbeing of all children and young people involved in our activities and programs, whether we are undertaking research, engaging with the public or nurturing future scientists in person or online. Source – CSIRO Child Safe policy 2023  Join us and start creating tomorrow today!  How to Apply  Please apply on-line and provide a cover letter and CV that best demonstrate your motivation and ability to meet the requirements of this role.  Applications Close  8 December 2023, 11:00pm AEDTShow moreReport"
