company,job_title,location,salary,company_size,company_founded,company_type,company_industry,company_sector,company_revenue,job_description
The University of Queensland4.2 ★,Principal Research Data Analyst,Australia,"$114,037",5001 to 10000 Employees,--,College / University,Colleges & Universities,Education,$2 to $5 billion (USD),"School of the Environment Highly innovative and dynamic/collaborative team of experts: from state-of-the-art monitoring station to innovative data analysis and visualization Be part of a $4.2 Million dollar monitoring and evaluation program that is committed to ensuring the resilience of the Great Barrier Reef Excellent engagement with regional groups, industry, landholders – contributing to make a difference on the ground Co-located at our vibrant St Lucia Campus and the Eco sciences Precinct, Dutton Park About UQ As part of the UQ community, you’ll have the opportunity to work alongside the brightest minds, who have joined us from all over the world. Everyone here has a role to play. As a member of our professional staff cohort, you will be actively involved in working towards our vision of a better world. By supporting the academic endeavour across teaching, research, and the student life, you’ll have the opportunity to contribute to activities that have a lasting impact on our community. Join a community where excellence is at the core of our culture, contributions are valued and a range of benefits and rewards are available, such as: 26 weeks paid parental leave or 14 weeks paid primary caregiver leave 17% superannuation contributions 17.5% annual leave loading Access to flexible working arrangements including hybrid working options, flexible start/finish times, purchased leave, and a condensed fortnight Health and wellness discounts – fitness passport access, free yearly flu vaccinations, discounted health insurance, and access to our Employee Assistance Program for staff and their immediate family On campus childcare options Cheap parking (from just $5 a day) Salary packaging options About This Opportunity The Reef Catchments Science Partnership (RCSP) is a collaboration between the University of Queensland and the Queensland Department of Environment and Science. The Partnership focusses on conducting research that will provide scientifically robust and defensible science tools, systems and frameworks to enhance the Queensland Government’s environmental compliance, monitoring and evaluation capabilities associated with the Reef Protection Regulations and the Reef 2050 Water Quality Improvement Plan. For more information about the project, please click HERE for the appointment booklet The Principal Research Data Analyst & the Principal Research Data Analyst (Real Time) work as part of a senior research team to provide high-level, specialist technical research expertise to scientific research projects, programs and initiatives within the RCSP. This role involves undertaking quality assurance and quality control work on the water quality monitoring data for the Great Barrier Reef Catchment Loads Monitoring Program (GBRCLMP), as well as on-going collaboration with staff and students between the RCSP and Water Quality and Investigations in the Department of Environment and Science (WQI-DES). There is no direct supervision of staff at this stage but the positions will require the overview and coordination of regional stakeholders involved with water quality monitoring. The GBRCLMP is jointly delivered by a consortium of organisations that includes, but is not limited to, the RCSP, WQI-DES and James Cook University (JCU). Key responsibilities will include: Provides technical expertise to maximise research outcomes of quality assurance and quality control on traditional or real-time water quality monitoring data for the Great Barrier Reef Catchment Loads Monitoring Program, RP232 and associated programs, Undertakes specialist aspects of research in accordance with scientific research methodology involving traditional or real-time water quality monitoring, Performs fieldwork in support of GBRCLMP activities as negotiated and requested by WQI-DES. Leads the development of a proactive safety culture and implement continuous improvement. Participates in technical leadership of meetings and events, and participates in discussions and initiatives on technical support and innovation that advocate advancement of RCSP objectives, Contributes to and coordinates research outputs, joint preparation and authorship of reports, manuscripts and presentations where appropriate, Assists scientific method development, validation and sample analysis studies, Contributes to research quality assurance, control and improvement activities, in collaboration with senior research staff and stakeholders, Ensures a high standard of occupational health and safety standards and systems, including inductions, supervision, equipment training registers, administration of research facilities, inventories, reporting and investigating injuries, incidents and hazards. Contributes to the application of R code and/or Python code data analysis to water quality monitoring data and specifically traditional or real-time water quality monitoring data. Have a current Australian C class Driver’s Licence which is requirement of the position to assist in regional travel and monitoring requirements There are up 2 x full-time fixed-term positions through to 30th June 2026 with possible extension dependent on funding. At HEW level 7, the full-time equivalent base salary will be in the range $93,254.55 - $101,680.96, plus a generous super allowance of up to 17%. The total FTE package will be up to $109,107.82 - $118,966.72 annually. As this role is covered by an Enterprise Agreement, you will also receive regular remuneration increases – at least once a year. About You We are looking for an experienced and highly motivated Principal Research Data Analysts (Real-Time) and Principal Research Data Analyst to support the research outcomes within the Reef Catchments Science Partnership programs. The successful candidate will have significant experience and expertise in traditional or real-time water quality monitoring and evaluation. Completion of a post graduate qualifications in Science or Bachelor of Science with at least five years subsequent experience in traditional or real-time water quality monitoring and/or data analysis or an equivalent combination of relevant experience and/or education/training, Demonstrated research-relevant knowledge and skills with expertise in a wide range of specialist and general research techniques at all stages of the research cycle, Expertise in the application of quality assurance and quality control on traditional or real-time water quality monitoring data, Advanced knowledge of catchment and water quality monitoring and evaluation, Leadership skills, including the ability to supervise and develop more junior staff, Significant experience of working in dynamic team environments and across multiple agencies, Advanced technical capabilities in traditional or real time water quality monitoring equipment, Strong interpersonal and communication skills with proven ability to produce clear, succinct research documentation and the ability to liaise effectively with a wide range of research and scientific staff within the Reef Catchments Science Partnership, James Cook University and the Department of Environment and Science, A commitment to upholding the highest standard of research integrity, ethics and workplace health and safety. In addition, the following mandatory requirements apply: Work Rights: You must have unrestricted work rights in Australia for the duration of this appointment to apply. Visa sponsorship is not available for this appointment. Background Checks: All final applicants for this position may be asked to consent to a criminal record check. Please note that people with criminal records are not automatically barred from applying for this position. Each application will be considered on its merits.  Questions? For more information about this opportunity, please contact Dr Ryan Turner at ryan.turner@uq.edu.au  For application queries, please contact recruitment@uq.edu.au stating the job reference number (below) in the subject line. Want to Apply? All applicants must upload the following documents in order for your application to be considered: Cover letter addressing Selection Criteria (3 pages maximum); and Resume (maximum 10 pages). Other Information At UQ we know that our greatest strengths come from our diverse mix of colleagues, this is reflected in our ongoing commitment to creating an environment focused on equity, diversity and inclusion. We ensure that we are always attracting, retaining and promoting colleagues who are representative of the diversity in the broader community, whether that be gender identity, LGBTQIA+, cultural and/or linguistic, Aboriginal and/or Torres Strait Islander peoples, or people with a disability. Accessibility requirements and/or adjustments can be directed to recruitment@uq.edu.au Applications close Friday 17th November 2023 at 11.00pm AEST (Job Reference Number - R-31585). Please note that interviews will be tentatively scheduled for the week beginning 20th November 2023.Show moreReport"
Sunwater Limited,Cost Analyst,Brisbane,"$118,835",201 to 500 Employees,--,Company - Private,Wholesale,Retail & Wholesale,Unknown / Non-Applicable,"Full Time Location: Brisbane Job type: Accounting Applications close: 01 Dec 2023 E. Australia Standard Time Cost Analyst What makes Sunwater an exceptional workplace?  We are dedicated to providing our employees with a dynamic and secure work atmosphere, accompanied by an array of attractive benefits including:  Base salary starting from $118,835.45 12.75% superannuation Access to Banked Time and TOIL 17.5% leave loading Hybrid work environment with a genuine emphasis on work/life balance Access to Sunwater's MyBenefits hosted by Reward Gateway  The role  The Cost Analyst is responsible for preparing and overseeing the development of accurate estimates for projects by gathering cost intelligence information and analysing important metrics. These estimates will form the basis of detailed reports so the company can make informed decisions, assess estimates provided by third parties and compile quality project and program budgets.  Your responsibilities will include:  Collate and evaluate costs/estimates from contractors, consultants, vendors or internal groups. Develop a centralised database of current and previous estimates and providing benchmark data and rates to compare against for future projects. Facilitate data quality checks and risk analysis on cost and completed estimates. Develop and report on Value Score Indicators Develop estimates for data analysis, benchmarking, and cost intelligence. Managing and submitting estimate reports to key stakeholders (project managers, engineers, planning team, etc) Provide advice to project team members regarding the estimation process and/or estimate analysis. Develop and implementation an effective and efficient project estimating system and supporting processes. Positively promote and actively role model the Sunwater values and behaviours to support the delivery of our services.  About you  We are looking for someone with a well-developed interpersonal skills and ability to work collaboratively with internal and external stakeholders. They will have excellent written communication and the ability to prepare written reports, presentations, and other communications in a clear and logical manner. In addition, you will be able to demonstrate:  Bachelor of Business or Quantity Surveyor A minimum of 5 years’ experience in relevant Costing roles. Well developed risk management skills, with the ability to identify potential project risks. Well developed costing/estimating analytical skills, capabilities and excellent attention to detail. Well developed and proven conceptual, analytical and problem solving skills, with the ability to develop strategies and recommend solutions to complex issues. Demonstrated experience of project estimate to cost management (Budgets, cost, risk and opportunity accruals and fixed costs) - estimate alignment to CAPEX and OPEX. Experience in subcontractor management processes and the systems used to support the process  We strongly encourage applications from candidates who are seeking flexibility in their work arrangements. We understand the importance of work-life balance and value the diverse perspectives and experiences that individuals with flexible working needs bring to our team. Whether you are looking for part-time or other flexible arrangements, we are committed to exploring possibilities that accommodate your needs whilst ensuring successful outcomes for Sunwater. Please feel free to discuss your desired flexibility during the application process, and we will strive to create a mutually beneficial work arrangement.  For further information visit www.sunwater.com.au  Sunwater acknowledges Aboriginal and Torres Strait Islander peoples as the first peoples of this country and Traditional Custodians of the land and water we rely on. We respect and value their continued sacred connection to Country, including the diverse, rich traditions, languages and customs that are the longest living in the world. We acknowledge their resilience in the face of significant and ongoing historical, cultural, and political change within Australia. We recognise and value the importance of truth-telling today, and our role to listen and learn.  Please note that our recruitment process involves verifying references, conducting psychometric testing, performing background checks, and conducting a pre-employment medical evaluation.Show moreReport"
HAYS3.6 ★,Risk Analyst,Brisbane,"$110,000",5001 to 10000 Employees,1968,Company - Private,HR Consulting,Human Resources & Staffing,$2 to $5 billion (USD),"Opportunity to join a leading ASX-Listed organisation in Brisbane for an aspiring Risk Analyst Your new company Hays has exclusively partnered with a leading Agricultural organisation based inner Brisbane City. Our client is supported by a global distribution network and workforce. If you are an experienced Risk Analyst looking to join a well-established and supportive team, apply now! Your new role As the Risk Analyst, you will support the Head of Risk with coordinating and implementation of controls and mitigation for operational leaders and processes. As an effective business partner, you will work with a broad remit of stakeholders and build influence with decision makers. Key duties include:  Support the team in the implementation of effective controls and risk management. Use your expertise to drive impactful discussions with operational leads. Educate operations and other business units regarding risk management and mitigation. Conduct risk assessments. Management of insurance claims. Preparation of reports. Assist in investigating incidents. Travel to sites to engage with front-line employees. Other risk related or adhoc duties as required. What you'll need to succeed Minimum of 5+ years experience in a risk management role. Preferably in a large commercial or consulting firm. Graduate or post-graduate qualification in a related field. Demonstrated experience applying ISO 31000 risk management principles. Ability to work with a range of stakeholders. Pastoral or FMCG industry exposure is highly desirable. What you'll get in return At this organisation, you won’t just be a small piece of a big machine; you will be a key and essential part of the team. Every member of the team is focused on the delivery of exceptional outcomes for their clients and on providing a level of service that is second to none. With a unique culture, the firm is recognised as a place where people are supported and enjoy working. Competitive salary of 100K - 120K + Super (based on experience). 2 days WFH. Working within a collaborative and supportive team. What you need to do now If you're interested in this role, click 'apply now' to forward an up-to-date copy of your CV. If this job isn't quite right for you but you are looking for a new position, please contact Taylor Woodforth at Taylor.Woodforth@hays.com.au, 07 3243 3084 for a confidential discussion on your career. #2812630Show moreReport"
WSP Australia3.7 ★,Senior Business Analyst - Remote,Brisbane,"$95,406",10000+ Employees,1959,Company - Public,Architectural & Engineering Services,"Construction, Repair & Maintenance Services",$5 to $10 billion (USD),"Work options: Hybrid Hybrid working environment - Work from home or in one of our offices throughout Australia! Join our team of intelligent and collaborative Changemakers and make your mark on tomorrow! WSP is one of the world's leading engineering professional services consulting firms, bringing together approximately 5,500 talented people across more than 50 offices in Australia and New Zealand. We are technical experts who design and provide strategic advice on sustainable solutions, engineering projects that will help societies grow for lifetimes to come. www.wsp.com WSP Digital is a part of a global team of innovators that use digital technologies to realise our customer’s needs through projects in varied industries and locations. We provide integrated services in website and application design, user experience, systems architecture, solutions architecture, website development, system integration, testing, maintenance and hosting Our Digital team works collaboratively to design and deliver innovative technology solutions that assist our clients to create a better future for our cities, regions, communities and the environment. We incorporate software development, data analytics, visualisation, digital engineering, geospatial and cloud into a truly integrated service. The Opportunity: Following a number of project wins, we are looking to hire a Senior Business Analyst to join any of our offices nationally. We would also consider individuals located anywhere within Australia to work remotely from home. You will liaise with clients to gain a thorough understanding of the project requirements and the needs of their end users. You will document and translate project scopes, take ownership for quality control and technical excellence, identify innovation opportunities and ensure the technical teams are empowered to deliver projects to timelines and budget. This is an amazing opportunity to work on major projects across Australia and globally, and positively impact the lives of the communities using infrastructure. You will also have the chance to work with some of the brightest subject matter experts in the fields of engineering, climate change and resilience, planning and more. What you’ll do: Elicit and facilitate the gathering of complex business requirements from various key stakeholders via workshops, interviews or other contact methods. Analyse, model and document business requirements (e.g. confirm functional and non-functional requirements, support clients in defining business requirements and functional design, business process modelling, etc.) Work as an intermediary between our software development team and our clients to ensure a shared vision of our projects Perform business analysis activities during all phases of the system development lifecycle (incl. design, development, testing and implementation) Develop detailed functional and user experience test scenarios Project manage your own workflow to achieve exceptional outcomes on time/budget Drive yourself to learn and grow, so we can achieve our goals as a business and create an abundance of opportunities About you: You would have proven extensive experience as a Senior Business Analyst, ideally gained in a consulting/advisory environment. You will also bring: Excellent verbal and written communication skills A sense of empathy and an ability to walk in your clients’ shoes Ability to create technical specs, identify business needs, elicit requirements and map out processes A logical approach to organising detailed and complex systems Experience managing multiple clients and projects A positive can-do attitude and passion for learning Knowledge of different project management methodologies (Waterfall (e.g. PRINCE2, PMP) and Agile (e.g. Scrum) Formal education in a STEM or Communication driven field About WSP WSP is one of the world's leading engineering professional services consulting firms, bringing together approximately 4,500 talented people across 14 offices in Australia. We have committed to halving the carbon footprint of our designs and advice by 2030. Our sustainable solutions and Future Ready™ projects will help societies grow for lifetimes to come. Our vibrant workplace culture is an important part of what makes this a great place to work. As a leader in WSP, you will have the opportunity to influence and contribute to our social and community initiatives while collaborating with your colleagues to make a positive impact on people’s lives. You will also enjoy the rewarding experience of mentoring younger professionals and seeing them succeed and progress in their careers over time. WSP prioritises the health and wellbeing of our people by offering flexible working, 12 months parental leave, opportunities for global mobility, purchased additional leave, and a competitive salary among many more benefits designed to help you thrive. We are committed to providing an inclusive and equal opportunity workplace. We promote Indigenous voices and are actively delivering a ‘Stretch’ level Reconciliation Action Plan. We are a Workplace Gender Equality Agency Employer of Choice, support the LGBTQI+ community, and encourage all employees to bring their whole selves to work. Think this could be the opportunity for you? Apply now to begin your journey with WSP. VideoShow moreReport"
