company,job_title,location,salary,company_size,company_founded,company_type,company_industry,company_sector,company_revenue,job_description
Bluefin Resources4.0 ★,Senior Business Analyst - ERP,Brisbane,$0,51 to 200 Employees,--,Company - Private,--,--,Unknown / Non-Applicable,"The Company  Large enterprise employer in Brisbane with a genuine passion and commitment for creating better futures for Queenslanders. The organisation is going through a whole of business digital transformation to better serve their large internal customer base. On the back of building a new digital leadership team they are now embarking on an ambitious transformation program that will significantly improve the customer and employee experience.  The role  You will be working from inception to delivery on a large scale ERP implementation project partnering with key stakeholders and vendors.  Your experience  ‒ Spearheading the design and implementation of business transformation workstreams and initiatives.  ‒ Structuring and executing in-depth analysis to fuel the development and execution of the transformation vision and plan.  ‒ Forge strong connections and seamless coordination with internal partners and key stakeholders, ensuring clear understanding and effective communication of requirements.  ‒ Play a vital role in crafting and disseminating transformation project materials and artifacts, amplifying the impact of your efforts.  ‒ Thrive in a collaborative environment, collaborating within the Digital Transformation area and across cross-functional teams. Elicit and analyse requirements and business rules relative to the initiative being worked on using techniques such as Problem/Hypothesis statements, epics/stories, systems modelling and user scenarios. Utilise fit for purpose techniques to document as-is and to-be process and value steam maps.  ‒ Requirements gathering and compiling business data. Conduct thorough business process reviews, offer strategic recommendations. Create detailed reports, facilitate solution designs. Attend key meetings for consultation and planning. Experience with ERP strongly regarded.  What's on offer?  On offer is an attractive daily rate with high likelihood of extension as there is an approved and funded project pipeline well into 2025 and beyond. The role is Brisbane based with a hybrid working model where you can manage your work life balance while being on site for key business meetings.  How to apply  To apply please click the Apply Now button below. To find out more please contact Sophie Redmond on 0466 714 466. IMPORTANT: By submitting your email address and any other personal information when you APPLY to a job, you consent to such information being collected, held, used and disclosed in accordance with our COLLECTIONS NOTICE and PRIVACY POLICY.  http://www.bluefinresources.com.au/privacy-policy BBBH55207_169950801012878Show moreReport"
Kings Resources Pty Ltd,Senior Insights Analyst - Workforce,Brisbane,"$110,000",Unknown,--,Company - Public,--,--,Unknown / Non-Applicable,"Senior Insights Analyst - Workforce Permanent role Kelvin Grove   We are looking for a Senior Insights Analyst – Workforce who will play a crucial part in delivering valuable people metrics that fuel strategic initiatives across the organisation.  The role requires you to bring strong data analytics skills combined with a solid understanding of statistical knowledge and experience in PowerBI, Excel to deliver and modify reports and dashboards   Responsibilities:  Consulting with stakeholders to understand business requirements to tailor and develop appropriate reporting solutions. Analysis of qualitative and quantitative data to identify workforce trends and insights to support business initiatives. Share and present insights to engage stakeholders in data-driven decision-making. Proactively review and ensure relevance of the data and measures being reported to ensure alignment to our strategy and priorities. Maintaining the accuracy of current reports and dashboards Assessing and continuously improving data management, analysis, and reporting processes   Skills required:  Strong data analytics skills with understanding of statistics knowledge and concepts Experience in analysing both structured and unstructured data. Strong technical skillset with experience with tools such as PowerBI, PowerQuery or DAX Demonstrated experience in designing and creating dashboards for a wide range of audiences. Demonstrated ability to present insights in accessible and engaging ways to a range of stakeholders. Working knowledge of HR Information Systems (e.g., Workday, SuccessFactors) Experience in designing and establishing processes.   This is a permanent role and there is a requirement to be based onsite 2 days a week in Kelvin Grove, Queensland  In order to apply you must be COVID vaccinated x 2 and latest flu vaccinated. Apply now with your updated resume in word format and connect for detailed role discussion.Show moreReport"
FINDMEA,Business Procurement Analyst,Thornlands,$64.25,1 to 50 Employees,--,Company - Private,--,--,Unknown / Non-Applicable,"Location: Thornlands Type: Temporary Post Date: Fri Nov 3 00:44:21 2023 Ref: 200014663 Business Procurement Analyst  $64.25 hour + super Monday to Friday, 08:30am - 16:15pm Full-time hourly basis Start: 13th of November 2023 to 30th of June 2024 with possible extension Great organisation values with a supportive team on-site Exciting position to gain exposure with your local council.  Our client is seeking a professional and experienced Business Procurement Analyst, responsible for developing procurement intelligence. To be successful in this role, please find the following requirements:  Manage a range of procurement specific data-gathering and analytical activities to support business decision marketing, business improvement, opportunity analysis, procurement planning, performance measurement and new procurement initiatives. Provide expert analytical advice on a wide range of procurement matters, especially as they relate to the defined areas of contract spend or compliance. Analyse, develop and implement business improvement solutions in collaboration with accountable business owners. Prepare detailed documentation and professional reports on analysis of business processes, interpret the information and recommend solutions, incorporating change management tools and implementation plans. Consult, negotiate and influence relevant internal and external stakeholders to achieve understanding and buy-in that enables effective delivery of strategic procurement practices.  This is a great opportunity to gain experience and start your career within a government department in 2023!  If interested in this opportunity please click apply or contact Kirsty on 0481 773 358 for further information.  About Us: FINDMEA is a local Qld based agency with National Reach and a passion for what we do. With over 40 years’ experience we know how to care for our candidates and ensure we see beyond the resume to uncover your true potential.Show moreReport"
Robert Half3.8 ★,BI Manager | Not for profit | Health & Aged Care,Brisbane,"$155,000",10000+ Employees,1948,Company - Public,HR Consulting,Human Resources & Staffing,$5 to $10 billion (USD),"An opportunity to join a hugely successful not for profit organization in central Brisbane at a very exciting time.  The Company Robert Half Technology are working alongside a members-based not for profit organisation within the Health and Aged care sector who are going through an exciting time expanding their Business Intelligence and Data team. Our client continue to grow their foot print across the state and are looking to employ their first Business Intelligence Manager to help lead and drive the business forward. Along with offering a hybrid working environment, our client have excellent benefits that are incomparable in the market. The Role This is a newly created position which will involve a hands-on contribution approach as well as be responsible for leading and growing out the division. A number of the day to day duties will include the following: Responsibilities Drive the design, development and implementation of the Business Intelligence Solutions including data warehousing, performance reporting, planning and analytics. Work closely with the executive and senior leadership team in analysing data to deliver key insights to improve the organisations efficiency Work hands on within the datawarehouse and be comfortable using PowerBI from a reporting and visualization perspective Be a key driver in building out the team and be responsible of hiring and retention within the department Provide expert knowledge and technical support for both project based work and BAU relating to the BI best practices. Requirements: Experience leading a team within the Business Intelligence and Data space within an organisation Demonstrated experience working with data warehouse environments including design, modeling, security, reporting and analytics. Strong working knowledge of the Microsoft suite including SQL Server, Power BI and MS Azure. Ability to interpret and document data models, data structures and understand data flows across multiple systems Learn more about our Brisbane recruitment services: https://www.roberthalf.com.au/brisbane By clicking 'apply', you give your express consent that Robert Half may use your personal information to process your job application and to contact you from time to time for future employment opportunities. For further information on how Robert Half processes your personal information and how to access and correct your information, please read the Robert Half privacy notice: https://www.roberthalf.com.au/privacy-statement. Please do not submit any sensitive personal data to us in your resume (such as government ID numbers, ethnicity, gender, religion, marital status or trade union membership) as we do not collect your sensitive personal data at this time.Show moreReport"
Jacobs4.0 ★,Section Leader - Digital Advisory and Advanced Data & Analytics (ANZ),Brisbane,,10000+ Employees,1947,Company - Public,Architectural & Engineering Services,"Construction, Repair & Maintenance Services",$10+ billion (USD),"Our People & Places Solutions business – reinforces our drive to improve the lives of people everywhere and epitomizes the ""why"" of what we do – the tremendous positive impact and value our solutions bring to our communities and society as a whole. From facilities delivering life-saving therapies and ensuring clean water to enabling the connection of people through all modes of transportation and providing access to technology – we're integrating a multitude of these solution elements to build the smart environments of tomorrow.  Start your Jacobs career with a company that inspires and empowers you to deliver your best work so you can evolve, grow and succeed – today and into tomorrow.  Your Impact: At Jacobs, we know that when it comes to a world that’s smarter, more connected and more sustainable, digital solutions are an important thread linking it all together. In our digital advisory work, we’re leveraging innovative technologies and big data analytics to solve the world’s most critical challenges. From shaping the safer cities of tomorrow, to protecting against climate change – we’re combining diverse talents with deep client-application experience and digital intelligence to deliver solutions that connect people and places with the means to work smarter and live better, and make an enduring, positive difference in the world. We have been on a remarkable journey of transformation. Transitioning from being a professional services provider across engineering, design, and construction to becoming a global solutions advisor and provider, with digital capabilities at our core. As our clients navigate digital transformation and growing cyber risks, we have positioned ourselves at the forefront of this growth, adding capabilities, products, and tools to serve a growing set of clients. Due to this extraordinary development, we are seeking an inspirational leader to contribute excellent advisory along with driving operational brilliance for the Digital Advisory and Advanced Data & Analytics (DA/ADA) section across the Australia and New Zealand region. The (DA/ADA) practices are a key platform to transformation and growth to both the Digital Solutions business as well as the broader ANZ organisation, and effective leadership of this group will ensure continued growth of this offering. The successful candidate can be based in any of the offices in the following ANZ locations - Perth, Melbourne, Sydney, Brisbane, Auckland, Wellington, Christchurch. Here’s What You’ll Need: In this role, you will have the fantastic opportunity to lead a high performing team with an established pipeline of work and existing customer relationships. While supporting the Director of Operations, you will lead and develop the Digital Advisory and Advanced Data & Analytics section within the Digital Solutions business in ANZ. Utilising your tertiary qualification/s, and relevant professional services/consulting experience, you will demonstrate your stellar record of accomplishment in building genuine client relationships, contributing to business growth, and showcasing your strategic mindset. In this position, your focus will be on: Nurturing and empowering your team, including coaching and mentoring employees with an aim to support professional development. Exemplifying outstanding guidance and people management skills that seamlessly align with Jacobs’ cultural priorities and values. Providing strategic direction for the (DA/ADA) section, including planning and implementation. Clearly and effectively communicating your vision that aligns with Jacobs’ goals and mission. Staying abreast of industry trends and maintaining a curious mind to drive sound commercial decision making. Jacobs. A world where you can. At Jacobs, we support your personal life and career journeys. From our inclusive employee networks to our positive mental health champions, we're committed to driving a culture of caring where you can be you. With safety and flexibility always top of mind, we've gone beyond traditional ways of working to help you uncover a working arrangement that delivers the flexibility, tools and space to maximise your potential. We're the 2023 winners of the Consult Australia People First Award for our suite of employee benefits that support all our employees in all stages of their personal and professional lives. For the 6th consecutive year, we've been named an Employer of Choice for Gender Equality by the Workplace Gender Equality Agency (Australia). In New Zealand, we're a founding member of The Diversity Agenda and are committed to making our industry more inclusive and diverse. In Australia, our Reconciliation journey continues to be a considerable focus across all levels of the Jacobs community as we progress our Innovate level Reconciliation Action Plan (RAP). Our Bronze Employer status in the Australian Workplace Equality Index for LGBTI+ inclusion recognises our progress in creating an environment where our Jacobs employees can bring their whole selves to work. We aim to embed inclusion and diversity in everything we do. We know that if we're inclusive, we're more connected, and if diverse, we're more creative. We accept people for who they are, regardless of age, disability, gender identity, marital status, mental health, race, faith or belief, sexual orientation, socioeconomic background, and whether you're pregnant or on family leave. This is reflected in our eight global Jacobs employee networks centred on driving inclusion and diversity – ACE, Careers, Enlace, Harambee, OneWorld, Prism, Vetnet, and our Women’s Network – find out more about our Jacobs Employee Networks here. No matter what drives you, you'll discover a way to cultivate, nurture and achieve your goals – all at a single global company. We're an equal opportunity employer and encourage candidates of diverse backgrounds to apply. Aboriginal and Torres Strait Islander peoples are strongly encouraged to apply. Jacobs aims to provide cultural safety at our interviews. Aboriginal and Torres Strait Islander peoples are invited to nominate a cultural representative to participate on the interview panel; please let your recruiter know in your application. Accessibility Please contact the team if you require support or reasonable adjustments regarding our recruitment process (for example, you need the application form in a different format). Don't meet every single requirement? Studies have shown that women and people from marginalised or underrepresented backgrounds are less likely to apply for jobs unless they meet every qualification. At Jacobs, we're dedicated to building a diverse, inclusive, and authentic workplace, so if you're excited about this role but your experience doesn't align with every requirement in the job description, we encourage you to apply anyway. You may be the right candidate for this or other roles. Please note: If you are being represented by a recruitment agency you will not be considered, to be considered you will need to apply directly to Jacobs.Show moreReport"
Talent Street5.0 ★,Business Analyst,Brisbane,"$94,868",1 to 50 Employees,2013,Company - Private,"Staffing, Recruitment & Subcontracting",Human Resources & Staffing,Unknown / Non-Applicable,"Talent Street are seeking an experienced 2x Business Analysts to join one of our QLD private clients in the Health Sector.  Initial Contract: 3 months starting in January 2023 (confirmed extension) Location: Brisbane  Must have Right to Work in Australia  Key Responsibilities:  This role would be responsible for performing end to end business analysis, bringing in strong requirements management, technical analysis, and design capabilities to work effectively with business and delivery partners Coordinate and support the delivery of analysis deliverables in the LIS Replacement Project (Laboratory Information System) addressing challenges associated with specific components as well as addressing specific/tailored needs and requirements Support a fit for purpose system and business readiness approach and provide expertise to ensure the technical and business solution as designed is implemented across the agreed components Work with solution, business and implementation leads to ensure the solution components and business readiness is effectively achieved Participate in the detailed documentation of acceptance criteria and test cases Participate and commit to the go live support activities including the support of the business processes for the system warranty (anticipated to be 4 to 6 weeks after go live) Work hard to understand business drivers, needs and expectations and help communicate that across delivery teams, ensuring and supporting business areas to prepare for and implement the needed changes Ensure best practice support for business analysis for the following: System integration product readinessSolution development product readinessInformation and privacy requirementsSystem configuration product readinessData migration readinessInstrument readinessBusiness testing and business change readiness (impact assessments)Go Live system and business readiness Effectively represent, negotiate, and influence colleagues and suppliers to ensure the solution and business implementation is fit for purpose Work with business and delivery partners to effectively ensure a safe and ready product is firstly ready for testing and secondly to ensure defects are resolved in a timely manner Promote the project goals, manage communications, and quickly establish and maintain relationships with key stakeholders (particularly in impacted business areas) Manage allocated risks in collaboration with the project manager and delivery leads within agreed tolerances, escalate, and report any project risks in a timely manner.  Essential Skills & Knowledge:  Significant experience as a business analyst in large and complex organisations Experience undertaking Technical / System Analysis, with a strong focus on eliciting Non-functional requirements, identifying, and clarifying interface/data requirements and conducting break/fix analysis. Experience in health projects is very much preferred with ideally LIS project experience Experience in managing requirements through their lifecycle (e.g., elicitation, traceability, prioritisation, communicating requirement intent, assessing change requests and enhancements, supporting defect rectification, and identifying requirements gaps) High level skills with MS Visio is essential Experience in utilising Jira would be ideal Experience with MS teams ideal High level communication skills with technical, business and project resources  Working Arrangements:  Start and finish times negotiable 80% onsite, 20% remote work preferred   To find out more, please click ""Apply"" or contact Josie Esposito on 0415 506 922 or send your CV to jesposito@talentstreet.com.au.  Applications close on Monday 19/12/2022Show moreReport"
