company,job_title,location,salary,company_size,company_founded,company_type,company_industry,company_sector,company_revenue,job_description
G8 Education3.0 ★,Financial Analyst,Varsity Lakes,"$64,074",10000+ Employees,--,Company - Public,Preschools & Childcare Services,Education,$500 million to $1 billion (USD),"512457 Varsity Lakes, QLD, 4227 Finance Permanent Full time Add to favourites Favourite View favourites G8 Education is one of Australia’s largest early education and care providers, with more than 420+ centres across Australia and over 10,000 team members who are all helping shape the lives of over 42,000 children every day. Our core values of passion, innovation, dedication, compassion, and integrity, unite us on our journey to ensure the health and happiness of future generations. We are committed to developing a culture that empowers and rewards our team of early childhood educators, teachers, leaders, and support office.  The Opportunity  The Financial Analyst will provide in depth strategic and analytical information to drive optimal business decisions in the areas of operations, network growth and portfolio performance management. The opportunity will be one that will play a pivotal role in supporting our national footprint, whilst working in partnership with various stakeholders.  Your day-to-day  No two days are the same; this role is diverse, with depth and breadth to cement your career, now and into the future. Areas of core responsibility include, but are not limited to:  Primary responsibility is to support the Financial Planning & Analysis Manager and departmental heads in the Group budget planning process including assessing sensitivities and rolling forecasts for the group using a planning software tool Ability to analyse capital management initiatives including acquisition proposals using various funding sources and business case modelling Providing relevant and accurate analytical review of the Group’s data and key performance metrics Providing comprehensive market, competitor and benchmarking research, assessment and financial analysis Developing and maintaining financial models and system reporting tools Providing financial and strategic analytics to support senior management on operations, new business opportunities, acquisition analysis and other projects Creating efficiencies in reporting methodologies Undertake regular reviews of existing portfolio for demographic, economic and commercial drivers Using data analytics identify potential centre locations and viability of existing centres Assess new centre opportunities including pricing mechanisms and due diligence requirements Produce documentation of results and findings with ability to interpret and present back to the business  About You  You thrive in a fast-paced and engaging work environment, valuing strong partnerships, collaboration, and a commitment to excellence. As someone who takes ownership of outcomes, you embrace the complexity and challenges that come with this role, while maintaining an agile and result-driven mindset. To be successful in this role, you should possess the following skills and experiences:  High attention to detail & problem solving skills Prior use of a financial planning solution (Jedox desirable) 4+ years experience in analyst roles Advanced level of excel financial modelling skills Proven ability of analytical skills and providing key insights and recommendations A good communicator across all levels of the business Prior experience in forecast & budget modelling using a planning tool Demonstrated commercial acumen, particularly modelling of scenarios Member or studying towards qualification to be a member of a professional accountancy body (eg ACA, CPA, CIMA) Hold, or be willing to obtain, a valid working with children check  Benefits Include:  Competitive salary package Work From Home & Hybrid working conditions encouraged. Flexibility to travel to both Support Office locations, Brisbane CBD and Gold Coast. Career development opportunities as part of a large ASX-listed company Flexible working arrangements and role autonomy Access a 50% discount on early education and childcare fees at any G8 Education Centre. Exclusive access to our employee benefits program covering a wide range of discounts and promotions.  This is a rare opportunity; if you want a diverse, challenging and personally fulfilling role, apply now!  Please note the advertising closing date is indicative only. G8 Education reserves the right to close the advertisement before this date is reached. Therefore, it is encouraged that you submit your application as soon as possible.  G8 Education is a committed advocate for child protection, safety and wellbeing. We have a zero tolerance for any form of child abuse or harm. The safety and wellbeing of children will always be our priority and all team members are expected to embrace this shared commitment. All G8 Education employees will need to hold a relevant Working with Children Check upon their commencement into the business.Show moreReport"
Hudson Australia4.0 ★,Senior Business & Data Analyst - Central Pharmacy Future State,Brisbane,"$137,870",501 to 1000 Employees,1985,Company - Private,HR Consulting,Human Resources & Staffing,Unknown / Non-Applicable,"The role is responsible for analysing data, developing and implementing the future state operating model and associated business processes, and providing actionable insights to support decision-making.  The role requires a strong analytical mindset, process expertise and the ability to work collaboratively across functional work streams. The Business and Data Analyst plays a pivotal role in ensuring the success of the Central Pharmacy Future State Program.  The role will work as part of a dedicated program delivery team within one of the three work programs that make up the Procurement & Supply Chain Optimisation Portfolio.  Key Responsibilities:  Adhere to defined service quality standards, health and safety policies and procedures relating to the work being undertaken to ensure high quality, safe services and workplaces. Transfer of knowledge and upskill employees. Collect, analyse and interpret complex data sets related to pharmaceutical and supply chain processes and performance, develop innovative solutions, options and recommendation in alignment with broader business strategy, organisational goals and legislative requirements. Guide the development and implementation of the Central Pharmacy operating model and business processes in the context of relevant legislation and the implementation of S/4HANA Extensive Warehouse Management (EWM) system software and associated barcoding and scanning solutions. Analyse and document the impacts of the changes to the Central Pharmacy operating model to support the development of change impacts assessment there by providing input into appropriate change interventions. Collaborate closely with specialist teams across the P&SCO ortfolio, Supply Chain Surety Branch and Hospital and Health Services (HHSs) to model requirements and translate these into technical and business specification, whilst ensuring optimal integration of future state processes across all functions of the Central Pharmacy Supply Chain, including purchasing, manufacturing, inventory, transport and reverse logistics. Identify opportunities to optimise supply chain processes through data-driven insights and recommendations ensuring the implementation of the highest standards of customer service and compliance. Ensure data accuracy, integrity and consistency by implementing data collection, validation and cleansing processes to support the implementation of S/4HANA EWM and associated integration points to legacy system.  The position operates as part of a specialised project delivery team and reports to the implementation stream lead. The position does not have any direct reports.  Essential Requirements:  Expert knowledge of world class warehousing operating models and processes in an environment of fast-moving inventory and related space utilisation, logistics and materials handling practices. Well-developed ability to understand how supply chain processes and improvements contribute to organisational goals and ensure data analysis and recommendations are aligned with the broader business strategy. High level of proficiency and skills in statistical and quantitative analysis and the use of data analysis tools and software to collect, clean and analyse large datasets to develop creative and innovative solutions to complex problems. Demonstrated knowledge of data management and data manipulation techniques and high technical proficiency and competence in using data visualisation tools to create reports and dashboards, preferably in a warehousing environment. Deep understanding of interrelationships between warehousing processes with other functions in a complex supply chain system such as purchasing, inventory, transport and logistics and an ability to connect data insights to business objectives and strategy. Conceptual, problem-solving and analytical skills, to identify problems, propose innovative and practical data-driven solutions in a complex and dynamic environment with a focus on documenting analysis processes and findings. Highly motivated to work effectively across functional teams, foster collaboration and build relationships across varied stakeholders by communicating confidently to a range of audiences and undertake effective consultation and negotiation processes.  Other Requirements:  Travel may be required between Brisbane sites. Highly experience in the use of tools such as Microsoft Access, SQL, Power BI Microsoft Excel and Visual Basic which are vital in handling and analysing key data. Proficient in the use of process modelling tools and has the fundamental understanding of industry recognised process notations such as Business Process Model and Notation (BPMN) or Unified Modelling Language (UML). Familiarity with S/4HANA EWM and OPIM modules, particularly related to the back-end data tables and the key elements of the data tables that drive the behaviour of the S/4HANA solution.  Like to know more?  To submit your application, please apply online using the appropriate link below. Alternatively, for a confidential discussion, please contact Kylie Graham in our Brisbane office on 07 3185 5339 or email kylie.graham@hudson.com, quoting Ref No. 233652.Show moreReport"
Frizelle Sunshine Automotive2.7 ★,Workforce Planning Analyst - Contact Centre,Southport,"$77,071",501 to 1000 Employees,--,Company - Public,--,--,Unknown / Non-Applicable,"Join an ASX listed organisation in a time of growth Great company culture with amazing benefits on offer We celebrate our team with quarterly and annual awards for high achievers Frizelle Sunshine Automotive is part of Peter Warren Automotive Holdings, one of Australia's largest multi-franchise automotive dealer groups. We have expanded across South West Sydney, Sydney’s North Shore, Regional NSW, Northern NSW, and throughout South East Queensland and Victoria. With some of the finest vehicle brands in the world we cover all aspects of vehicle ownership. With over 2000 employees across QLD, NSW and VIC, we are focused on growing and developing a career path for all our people. Frizelle Sunshine Automotive is actively seeking a dedicated and analytical Workforce Planning Analyst for our Contact Centre based in Southport. We are committed to delivering unparalleled customer service, and we're looking for someone to help us optimize our staffing levels to uphold this commitment. If you have a strong analytical mind, excellent scheduling abilities, and want to make a meaningful impact, then this role may be for you. About the role: Assist in forecasting call volumes and staffing needs based on historical and seasonal data. Use workforce management software to create efficient agent schedules, ensuring optimal coverage at all times. Monitor real-time call centre metrics, making real-time adjustments to schedules and staffing as needed. Coordinate and schedule annual leave for agents, balancing individual preferences with operational needs. Plan and schedule internal meetings, training sessions, and other non-customer-facing activities without compromising service levels. Analyze Key Performance Indicators (KPIs) such as Average Handle Time, Abandon Rates, and Service Level Agreements to identify areas for improvement. Collaborate with Contact Centre management to address staffing challenges and propose solutions. Generate routine and ad hoc reports for management, presenting actionable insights to improve performance and efficiency.  About you: Minimum of 2 years' experience in workforce planning or call & resource role, ideally within a contact centre environment. Proficiency in workforce management tools (e.g, Genesis). Exceptional analytical, problem-solving, and organizational skills. Intermediate skills in Microsoft Excel or equivalent data analysis tools. The benefits of working for us: Commitment to development and mentoring from your team! Free Titans tickets for home games Discounted Bupa Private Health Insurance Employee Assistance Program (EAP) Exclusive discounts with our Samsung Partnership Program Discounted Gym memberships Apply now! All Frizelle Sunshine employees must; be entitled to work in Australia, complete a Federal Police Check and a Traffic History (QLD) or Driving Record (NSW) check.Show moreReport"
Office of the Australian Information Commissioner,"APS5/6 Data and Reporting Analyst, Business Analytics, Data and Reporting",Brisbane,"$90,143",,,,,,,"Are you interested and passionate about data and reporting?Type of vacancy: Ongoing and Non-ongoing, Full-timeJob Title: Data and Reporting Analyst, Business Analytics, Data and Reporting (BARD)Classification: APS5 and APS6Location: The OAIC operates a hybrid work model with a combination of remote working and office attendance. While some team members work from other locations within Australia, as this is a leadership role, with the majority of the team based in Sydney and some positions reporting to the role requiring onsite work attendance, the preferred position location is Sydney. Other locations will also be considered.About the Office of the Australian Information CommissionerWorking with the Office of the Australian Information Commissioner (OAIC) will put you at the forefront of data protection and access to information regulation. As an independent statutory agency, the OAIC’s work is of national significance and plays an important role in shaping Australia’s information handling landscape across the economy - from government, digital platforms and the online environment, to health, finance and telecommunications. We are an agency within the Attorney-General Department’s portfolio with responsibility for:privacy functions under the Privacy Act 1988 and other legislationfreedom of information, in particular review of decisions made by agencies and ministers under the Freedom of Information Act 1982.About the OpportunityThe Business Analytics, Data and Reporting team (BARD) is a small team responsible for data analytics and reporting at the OAIC. The team has a strong focus on the development of a data warehouse and the enhancement of self-service reporting and visualisation products.Working in the BARD team is an opportunity to develop and apply your analytical skills and strategic understanding, while delivering data analytics that support decision-making through accessible and digestible products. The team is made up of high-performing and experienced professionals – we enjoy the challenging nature of our work and we do that work in a collaborative, supportive and flexible way. The team prides itself in supporting our stakeholders, and innovation and continuous improvement in our products and data processes.As a Data and Reporting Analyst, you’ll use your experience and understanding of data analysis and business knowledge to address business problems and support data-driven decision making. You will use a variety of tools, languages and technical knowledge to analyse and interpret data and results and communicate using easy-to-understand language to support business outcomes.The OAIC is committed to diversity and inclusion. We encourage and welcome applications from people with disability, Aboriginal and Torres Strait Islander peoples, LGBTIQ+ people, people from culturally and linguistically diverse backgrounds, and mature age people.Job Specific Capabilities, Skills & ExperienceThe duties of the role include:extracting and integrating data from a range of sources to develop and maintain a range of reportscontribute to the design, development and testing of data visualisations and dashboardsassist in the preparation and delivery of agency statutory reporting data setssupport the embedding and implementation of the OAIC Data Strategycollaborate with key subject matter experts to develop fit-for-purpose reporting solutionsassist in preparing Executive Briefs and reports for the Executive and Operations Committeessupport the Assistant Director in the development and maintenance of an OAIC data warehouse as requiredother ad-hoc data requests.Essential:highly developed written and verbal communication skills with the ability to negotiate and communicate with influenceadvanced MS Excel and Power BI experienceMicrosoft SQL Server Management Studio (SSMS, SSRS and SSAS Tabular) proficiencya knack for translating high-level business requirements into technical solutionsability to interrogate complex data sets and succinctly articulate results to a non-technical audience in a digestible format.Desirable:Tertiary qualifications in a relevant field (such as Computer Science, IT, Mathematics or Economics).Detailed Vacancy InformationFor detailed information about these roles please refer to the downloadable job pack, available on the OAIC website, which can be accessed by clicking the apply button.The OAIC is committed to diversity and inclusion. We encourage and welcome applications from people with disability, Aboriginal and Torres Strait Islander peoples, LGBTIQ+ people, people from culturally and linguistically diverse backgrounds, and mature age people.Selections for vacancies at the Office of the Australian Information Commissioner are based on merit.How to ApplyVisit the OAIC website by clicking hereto review the download the candidate information pack.Please complete the application sheet (located within the candidate information pack) as part of your application.Closing DateTuesday, 31 October 2023 at 11:59 PM AEDT.Job Type: Full-timeSalary: $81,420.00 – $98,866.00 per yearWork Location: In personShow moreReport"
John Deere4.2 ★,Inventory Analyst,Australia,,10000+ Employees,1837,Company - Public,Machinery Manufacturing,Manufacturing,$10+ billion (USD),"Who We Are Integrity. Quality. Commitment. Innovation. These are our values and not only what we stand by but what we stand for. We believe in empowering people. We create and deliver solutions. We give back to community. We think differently and we do it better. Our innovative spirit has driven us to continually evolve and deliver solutions to our dealers and our community and made us a business that our people are proud of and proud to work for. At John Deere, we run so life can leap forward. This powerful purpose is our promise to humankind that we will dream, design, and deliver breakthrough products that sustain our world for generations to come. The world is counting on us to feed billions of people and build vital infrastructures in villages, towns and megacities. And we live up to the legacy our founder forged in a one-room blacksmith's shop nearly two centuries ago by creating a culture that brings out the best in all of us. A culture where great ideas thrive because every voice is heard. Title: Inventory Analyst Primary Location: Australia (AU) - Queensland- Crestmead Job Grade: 06 Hiring Manager: Kylie McMaster Major Purpose  As a Parts Inventory Analyst, you will play a pivotal role in delivering a distinctive Customer Experience. Your primary responsibility is to ensure the availability of parts through effective forecasting and inventory management across the entire lifecycle of assigned product lines. Role Objectives: Maintain and grow Customer Experience by ensuring parts availability at target levels on assigned product lines. Deliver Operational Excellence through providing input to forecast and order planning on assigned product lines in order to drive appropriate inventory levels utilizing market intelligence. Engage and leverage available technologies & systems to full potential supporting the Smart Connected Aftermarket. Participate in and foster a culture of Diversity, Equity and Inclusion within the business. About You  You bring experience in inventory management and supply chain, embodying an energetic, self-starting, and collaborative spirit. You take pride in your work and in fostering a positive work environment. What Skills You Need Inventory Management and Supply Chain Expertise Data Analytics skills Customer Service and Problem-Solving Intermediate Excel Proficiency Exceptional Cross-Team and Cross-Geography Communication Agility and Adaptability What Makes You Stand Out Demand Forecasting Proficiency Strong Technology Acumen Proven Experience in Continuous Improvement Education / Experience: Degree in Business/Marketing/Supply Chain would be desirable. What you’ll get in return At John Deere, you are empowered to create a career that will take you to where you want to go. Here, you'll enjoy the support to think outside the box and the advanced tools and technology that foster innovation and achievement. We are a Global company that truly values its people and provides a broad range of benefits which include a competitive remuneration package, flexible working, social activities, health and safety programs and ongoing training and development opportunities along with: Annual Leave Loading Professional Development Support (Higher Education, Training & Memberships) 14% Super (if you choose the John Deere Employee Super Plan) Purchase Leave Available Paid Community Leave Flexible Working Options Paid Parental Leave - 16 weeks for all parents We embrace and strive for a workforce that is as diverse, talented and passionate as the communities in which we live and operate, and to provide a workplace where people feel included, valued and supported. We welcome applications from all backgrounds and believe that by understanding and respecting each other’s differences we will perform at our best! What you need to do now If you have the experience outlined above, and the passion to succeed, we would love to hear from you! Please click the 'APPLY' button now and send through your resume and cover letter detailing your previous relevant experience and why you are the perfect candidate for our team. Applications for this position will close at close of business November 19, 2023 Note: Appropriate work authorisations are required in this country prior to application.  John Deere believes in the power of diversity in the workforce and we and are committed to creating an inclusive environment for all employees. John Deere Australia is proud to be recognised by Diversity Council Australia Ltd as an Inclusive Employer for 2022-2023. John Deere is proud to collaborate with WORK180- an international jobs network that connects smart businesses with talented women.Show moreReport"
